<?xml version="1.0" encoding="UTF-8"?>
<tns:Configuration hierarchy="vg" description="Virgin Islands (British)" xmlns:tns="http://www.example.org/Holiday"
                   xmlns:xsi="http://www.w3.org/2001/XMLSchema-instance"
                   xsi:schemaLocation="http://www.example.org/Holiday /Holiday.xsd">
  <tns:Holidays>
    <tns:Fixed month="JANUARY" day="2" descriptionPropertiesKey="NEW_YEAR"/>
    <tns:Fixed month="MARCH" day="6" descriptionPropertiesKey="STOUTTS_BIRTHDAY"/>
    <tns:Fixed month="MARCH" day="13" descriptionPropertiesKey="COMMONWEALTH_DAY"/>
    <tns:Fixed month="APRIL" day="14" descriptionPropertiesKey="christian.GOOD_FRIDAY"/>
    <tns:Fixed month="APRIL" day="17" descriptionPropertiesKey="christian.EASTER_MONDAY"/>
    <tns:Fixed month="JUNE" day="5" descriptionPropertiesKey="christian.WHIT_MONDAY"/>
    <tns:Fixed month="JUNE" day="17" descriptionPropertiesKey="SOVEREIGNS_BIRTHDAY"/>
    <tns:Fixed month="JUNE" day="30" descriptionPropertiesKey="TERRITORY_DAY"/>
    <tns:Fixed month="AUGUST" day="7" descriptionPropertiesKey="FESTIVAL_MONDAY"/>
    <tns:Fixed month="AUGUST" day="8" descriptionPropertiesKey="FESTIVAL_TUESDAY"/>
    <tns:Fixed month="AUGUST" day="9" descriptionPropertiesKey="FESTIVAL_WEDNESDAY"/>
    <tns:Fixed month="OCTOBER" day="20" descriptionPropertiesKey="ST_URSULA"/>
    <tns:Fixed month="DECEMBER" day="25" descriptionPropertiesKey="CHRISTMAS"/>
    <tns:Fixed month="DECEMBER" day="26" descriptionPropertiesKey="BOXING_DAY"/>
  </tns:Holidays>
</tns:Configuration>
