<?xml version="1.0" encoding="UTF-8"?>

<Configuration hierarchy="target" description="Trans-European Automated Real-time Gross settlement Express Transfer system closing dates"
               xmlns="https://www.focus_shift.de/jollyday/xml/ns/holiday"
               xmlns:xsi="http://www.w3.org/2001/XMLSchema-instance"
               xsi:schemaLocation="https://www.focus_shift.de/jollyday/xml/ns/holiday https://www.focus_shift.de/jollyday/xml/ns/holiday/Holiday.xsd">
  <Holidays>
    <Fixed validFrom="2000" month="JANUARY" day="1" descriptionPropertiesKey="NEW_YEAR"/>
    <Fixed validFrom="2000" month="MAY" day="1" descriptionPropertiesKey="LABOUR_DAY"/>
    <Fixed validFrom="1999" month="DECEMBER" day="25" descriptionPropertiesKey="CHRISTMAS"/>
    <Fixed validFrom="1999" month="DECEMBER" day="26" descriptionPropertiesKey="STEPHENS"/>
    <Fixed validFrom="2001" validTo="2001" month="DECEMBER" day="31" descriptionPropertiesKey="NEW_YEARS_EVE"/>
    <Fixed validFrom="1999" validTo="1999" month="DECEMBER" day="31" descriptionPropertiesKey="NEW_YEARS_EVE"/>
    <ChristianHoliday validFrom="2000" type="GOOD_FRIDAY" descriptionPropertiesKey="christian.GOOD_FRIDAY"/>
    <ChristianHoliday validFrom="2000" type="EASTER_MONDAY" descriptionPropertiesKey="christian.EASTER_MONDAY"/>
  </Holidays>
</Configuration>
