<?xml version="1.0" encoding="UTF-8"?>
<Configuration hierarchy="je" description="Jersey"
               xmlns="https://focus_shift.de/jollyday/schema/holiday"
               xmlns:xsi="http://www.w3.org/2001/XMLSchema-instance"
               xsi:schemaLocation="https://focus_shift.de/jollyday/schema/holiday https://focus_shift.de/jollyday/schema/holiday/holiday.xsd">
  <Holidays>
    <Fixed month="JANUARY" day="1" descriptionPropertiesKey="NEW_YEAR"/>
    <Fixed month="MARCH" day="25" descriptionPropertiesKey="christian.GOOD_FRIDAY"/>
    <Fixed month="MARCH" day="28" descriptionPropertiesKey="christian.EASTER_MONDAY"/>
    <Fixed month="MAY" day="2" descriptionPropertiesKey="EARLY_MAY_BANK_HOLIDAY"/>
    <Fixed month="MAY" day="9" descriptionPropertiesKey="LIBERATION"/>
    <Fixed month="MAY" day="30" descriptionPropertiesKey="SPRING_BANK_HOLIDAY"/>
    <Fixed month="AUGUST" day="29" descriptionPropertiesKey="SUMMER_BANK_HOLIDAY"/>
    <Fixed month="DECEMBER" day="26" descriptionPropertiesKey="BOXING_DAY"/>
    <Fixed month="DECEMBER" day="27" descriptionPropertiesKey="CHRISTMAS"/>
  </Holidays>
</Configuration>
