<?xml version="1.0" encoding="UTF-8"?>
<tns:Configuration hierarchy="ky" description="Cayman Islands" xmlns:tns="http://www.example.org/Holiday"
                   xmlns:xsi="http://www.w3.org/2001/XMLSchema-instance"
                   xsi:schemaLocation="http://www.example.org/Holiday /Holiday.xsd">
  <tns:Holidays>
    <tns:Fixed month="JANUARY" day="1" descriptionPropertiesKey="NEW_YEAR"/>
    <tns:Fixed month="JANUARY" day="25" descriptionPropertiesKey="NATIONAL_HEROES_DAY"/>
    <tns:Fixed month="FEBRUARY" day="17" descriptionPropertiesKey="christian.ASH_WEDNESDAY"/>
    <tns:Fixed month="APRIL" day="2" descriptionPropertiesKey="christian.GOOD_FRIDAY"/>
    <tns:Fixed month="APRIL" day="5" descriptionPropertiesKey="christian.EASTER_MONDAY"/>
    <tns:Fixed month="APRIL" day="14" descriptionPropertiesKey="ELECTION_DAY"/>
    <tns:Fixed month="MAY" day="17" descriptionPropertiesKey="DISCOVERY_DAY"/>
    <tns:Fixed month="JUNE" day="14" descriptionPropertiesKey="QUEENS_BIRTHDAY"/>
    <tns:Fixed month="JULY" day="5" descriptionPropertiesKey="CONSTITUTION_DAY"/>
    <tns:Fixed month="NOVEMBER" day="15" descriptionPropertiesKey="REMEMBRANCE"/>
    <tns:Fixed month="DECEMBER" day="27" descriptionPropertiesKey="CHRISTMAS"/>
    <tns:Fixed month="DECEMBER" day="28" descriptionPropertiesKey="BOXING_DAY"/>
  </tns:Holidays>
</tns:Configuration>
