<?xml version="1.0" encoding="UTF-8"?>
<tns:Configuration hierarchy="rs" description="Serbia"
                   xmlns:tns="http://www.example.org/Holiday" xmlns:xsi="http://www.w3.org/2001/XMLSchema-instance"
                   xsi:schemaLocation="http://www.example.org/Holiday /Holiday.xsd">
  <tns:Holidays>
    <tns:Fixed month="JANUARY" day="1" descriptionPropertiesKey="NEW_YEAR"/>
    <tns:Fixed month="JANUARY" day="2" descriptionPropertiesKey="NEW_YEAR"/>
    <tns:Fixed month="JANUARY" day="7" descriptionPropertiesKey="CHRISTMAS"/>
    <tns:Fixed month="FEBRUARY" day="15" descriptionPropertiesKey="CONSTITUTION_DAY"/>
    <tns:Fixed month="FEBRUARY" day="16" descriptionPropertiesKey="CONSTITUTION_DAY"/>
    <tns:Fixed month="MAY" day="1" descriptionPropertiesKey="LABOUR_DAY"/>
    <tns:Fixed month="MAY" day="2" descriptionPropertiesKey="LABOUR_DAY"/>
    <tns:Fixed month="MAY" day="9" descriptionPropertiesKey="VICTORY" localizedType="UNOFFICIAL_HOLIDAY"/>
    <tns:ChristianHoliday type="EASTER" descriptionPropertiesKey="christian.EASTER"/>
    <tns:ChristianHoliday type="GOOD_FRIDAY" chronology="JULIAN" descriptionPropertiesKey="christian.GOOD_FRIDAY"/>
    <tns:ChristianHoliday type="EASTER_MONDAY" chronology="JULIAN" descriptionPropertiesKey="christian.EASTER_MONDAY"/>
  </tns:Holidays>
</tns:Configuration>
