<?xml version="1.0" encoding="UTF-8"?>
<Configuration hierarchy="ky" description="Cayman Islands"
               xmlns="https://www.focus_shift.de/jollyday/xml/ns/holiday"
               xmlns:xsi="http://www.w3.org/2001/XMLSchema-instance"
               xsi:schemaLocation="https://www.focus_shift.de/jollyday/xml/ns/holiday https://www.focus_shift.de/jollyday/xml/ns/holiday/Holiday.xsd">
  <Holidays>
    <Fixed month="JANUARY" day="2" descriptionPropertiesKey="NEW_YEAR"/>
    <Fixed month="JANUARY" day="23" descriptionPropertiesKey="NATIONAL_HEROES_DAY"/>
    <Fixed month="FEBRUARY" day="22" descriptionPropertiesKey="christian.ASH_WEDNESDAY"/>
    <Fixed month="APRIL" day="6" descriptionPropertiesKey="christian.GOOD_FRIDAY"/>
    <Fixed month="APRIL" day="9" descriptionPropertiesKey="christian.EASTER_MONDAY"/>
    <Fixed month="MAY" day="21" descriptionPropertiesKey="DISCOVERY_DAY"/>
    <Fixed month="JUNE" day="18" descriptionPropertiesKey="QUEENS_BIRTHDAY"/>
    <Fixed month="JULY" day="2" descriptionPropertiesKey="CONSTITUTION_DAY"/>
    <Fixed month="NOVEMBER" day="12" descriptionPropertiesKey="REMEMBRANCE"/>
    <Fixed month="DECEMBER" day="25" descriptionPropertiesKey="CHRISTMAS"/>
    <Fixed month="DECEMBER" day="26" descriptionPropertiesKey="BOXING_DAY"/>
  </Holidays>
</Configuration>
