<?xml version="1.0" encoding="UTF-8"?>
<tns:Configuration hierarchy="de" description="Germany" xmlns:tns="http://www.example.org/Holiday"
                   xmlns:xsi="http://www.w3.org/2001/XMLSchema-instance"
                   xsi:schemaLocation="http://www.example.org/Holiday /Holiday.xsd">
  <tns:Holidays>
    <tns:Fixed month="JANUARY" day="1" descriptionPropertiesKey="NEW_YEAR"/>
    <tns:Fixed month="APRIL" day="15" descriptionPropertiesKey="christian.GOOD_FRIDAY"/>
    <tns:Fixed month="APRIL" day="18" descriptionPropertiesKey="christian.EASTER_MONDAY"/>
    <tns:Fixed month="MAY" day="1" descriptionPropertiesKey="LABOUR_DAY"/>
    <tns:Fixed month="MAY" day="26" descriptionPropertiesKey="christian.ASCENSION_DAY"/>
    <tns:Fixed month="JUNE" day="6" descriptionPropertiesKey="christian.WHIT_MONDAY"/>
    <tns:Fixed month="OCTOBER" day="3" descriptionPropertiesKey="UNIFICATION_GERMANY"/>
    <tns:Fixed month="DECEMBER" day="25" descriptionPropertiesKey="FIRST_CHRISTMAS_DAY"/>
    <tns:Fixed month="DECEMBER" day="26" descriptionPropertiesKey="SECOND_CHRISTMAS_DAY"/>
  </tns:Holidays>
  <tns:SubConfigurations hierarchy="be" description="Berlin">
    <tns:Holidays>
      <tns:Fixed month="MARCH" day="8" descriptionPropertiesKey="INTERNATIONAL_WOMAN"/>
    </tns:Holidays>
  </tns:SubConfigurations>
  <tns:SubConfigurations hierarchy="bb" description="Brandenburg">
    <tns:Holidays>
      <tns:Fixed month="APRIL" day="17" descriptionPropertiesKey="christian.EASTER"/>
      <tns:Fixed month="JUNE" day="5" descriptionPropertiesKey="christian.PENTECOST"/>
      <tns:Fixed month="OCTOBER" day="31" descriptionPropertiesKey="REFORMATION_DAY"/>
    </tns:Holidays>
  </tns:SubConfigurations>
  <tns:SubConfigurations hierarchy="bw" description="Baden-Württemberg">
    <tns:Holidays>
      <tns:Fixed month="JANUARY" day="6" descriptionPropertiesKey="EPIPHANY"/>
      <tns:Fixed month="JUNE" day="16" descriptionPropertiesKey="christian.CORPUS_CHRISTI"/>
      <tns:Fixed month="NOVEMBER" day="1" descriptionPropertiesKey="ALL_SAINTS"/>
    </tns:Holidays>
  </tns:SubConfigurations>
  <tns:SubConfigurations hierarchy="by" description="Bayern">
    <tns:Holidays>
      <tns:Fixed month="JANUARY" day="6" descriptionPropertiesKey="EPIPHANY"/>
      <tns:Fixed month="JUNE" day="16" descriptionPropertiesKey="christian.CORPUS_CHRISTI"/>
      <tns:Fixed month="NOVEMBER" day="1" descriptionPropertiesKey="ALL_SAINTS"/>
    </tns:Holidays>
    <tns:SubConfigurations hierarchy="mu" description="München">
      <tns:Holidays>
        <tns:Fixed month="AUGUST" day="15" descriptionPropertiesKey="ASSUMPTION_DAY"/>
      </tns:Holidays>
    </tns:SubConfigurations>
    <tns:SubConfigurations hierarchy="ag" description="Augsburg">
      <tns:Holidays>
        <tns:Fixed month="AUGUST" day="8" descriptionPropertiesKey="PEACE"/>
        <tns:Fixed month="AUGUST" day="15" descriptionPropertiesKey="ASSUMPTION_DAY"/>
      </tns:Holidays>
    </tns:SubConfigurations>
    <tns:SubConfigurations hierarchy="wu" description="Würzburg">
      <tns:Holidays>
        <tns:Fixed month="AUGUST" day="15" descriptionPropertiesKey="ASSUMPTION_DAY"/>
      </tns:Holidays>
    </tns:SubConfigurations>
    <tns:SubConfigurations hierarchy="re" description="Regensburg">
      <tns:Holidays>
        <tns:Fixed month="AUGUST" day="15" descriptionPropertiesKey="ASSUMPTION_DAY"/>
      </tns:Holidays>
    </tns:SubConfigurations>
    <tns:SubConfigurations hierarchy="in" description="Ingolstadt">
      <tns:Holidays>
        <tns:Fixed month="AUGUST" day="15" descriptionPropertiesKey="ASSUMPTION_DAY"/>
      </tns:Holidays>
    </tns:SubConfigurations>
  </tns:SubConfigurations>
  <tns:SubConfigurations hierarchy="he" description="Hessen">
    <tns:Holidays>
      <tns:Fixed month="APRIL" day="17" descriptionPropertiesKey="christian.EASTER"/>
      <tns:Fixed month="JUNE" day="16" descriptionPropertiesKey="christian.CORPUS_CHRISTI"/>
      <tns:Fixed month="JUNE" day="5" descriptionPropertiesKey="christian.PENTECOST"/>
    </tns:Holidays>
  </tns:SubConfigurations>
  <tns:SubConfigurations hierarchy="mv" description="Mecklenburg-Vorpommern">
    <tns:Holidays>
      <tns:Fixed month="OCTOBER" day="31" descriptionPropertiesKey="REFORMATION_DAY"/>
    </tns:Holidays>
  </tns:SubConfigurations>
  <tns:SubConfigurations hierarchy="nw" description="Nordrhein-Westfalen">
    <tns:Holidays>
      <tns:Fixed month="JUNE" day="16" descriptionPropertiesKey="christian.CORPUS_CHRISTI"/>
      <tns:Fixed month="NOVEMBER" day="1" descriptionPropertiesKey="ALL_SAINTS"/>
    </tns:Holidays>
  </tns:SubConfigurations>
  <tns:SubConfigurations hierarchy="rp" description="Rheinland-Pfalz">
    <tns:Holidays>
      <tns:Fixed month="JUNE" day="16" descriptionPropertiesKey="christian.CORPUS_CHRISTI"/>
      <tns:Fixed month="NOVEMBER" day="1" descriptionPropertiesKey="ALL_SAINTS"/>
    </tns:Holidays>
  </tns:SubConfigurations>
  <tns:SubConfigurations hierarchy="sl" description="Saarland">
    <tns:Holidays>
      <tns:Fixed month="AUGUST" day="15" descriptionPropertiesKey="ASSUMPTION_DAY"/>
      <tns:Fixed month="JUNE" day="16" descriptionPropertiesKey="christian.CORPUS_CHRISTI"/>
      <tns:Fixed month="NOVEMBER" day="1" descriptionPropertiesKey="ALL_SAINTS"/>
    </tns:Holidays>
  </tns:SubConfigurations>
  <tns:SubConfigurations hierarchy="sn" description="Saxony">
    <tns:Holidays>
      <tns:Fixed month="OCTOBER" day="31" descriptionPropertiesKey="REFORMATION_DAY"/>
      <tns:Fixed month="NOVEMBER" day="16" descriptionPropertiesKey="REPENTANCE_PRAYER"/>
    </tns:Holidays>
  </tns:SubConfigurations>
  <tns:SubConfigurations hierarchy="st" description="Saxony-Anhalt">
    <tns:Holidays>
      <tns:Fixed month="JANUARY" day="6" descriptionPropertiesKey="EPIPHANY"/>
      <tns:Fixed month="OCTOBER" day="31" descriptionPropertiesKey="REFORMATION_DAY"/>
    </tns:Holidays>
  </tns:SubConfigurations>
  <tns:SubConfigurations hierarchy="th" description="Thuringia">
    <tns:Holidays>
      <tns:Fixed month="SEPTEMBER" day="20" descriptionPropertiesKey="CHILDRENS_DAY"/>
      <tns:Fixed month="OCTOBER" day="31" descriptionPropertiesKey="REFORMATION_DAY"/>
    </tns:Holidays>
  </tns:SubConfigurations>
  <tns:SubConfigurations hierarchy="sh" description="Schleswig-Holstein">
    <tns:Holidays>
      <tns:Fixed month="OCTOBER" day="31" descriptionPropertiesKey="REFORMATION_DAY"/>
    </tns:Holidays>
  </tns:SubConfigurations>
  <tns:SubConfigurations hierarchy="hh" description="Hamburg">
    <tns:Holidays>
      <tns:Fixed month="OCTOBER" day="31" descriptionPropertiesKey="REFORMATION_DAY"/>
    </tns:Holidays>
  </tns:SubConfigurations>
  <tns:SubConfigurations hierarchy="hb" description="Bremen">
    <tns:Holidays>
      <tns:Fixed month="OCTOBER" day="31" descriptionPropertiesKey="REFORMATION_DAY"/>
    </tns:Holidays>
  </tns:SubConfigurations>
  <tns:SubConfigurations hierarchy="ni" description="Lower-Saxony">
    <tns:Holidays>
      <tns:Fixed month="OCTOBER" day="31" descriptionPropertiesKey="REFORMATION_DAY"/>
    </tns:Holidays>
  </tns:SubConfigurations>
</tns:Configuration>
