<?xml version="1.0" encoding="UTF-8"?>

<Configuration hierarchy="bo" description="Bolivia"
               xmlns="http://www.focus_shift.de/jollyday/xml/ns/holiday"
               xmlns:xsi="http://www.w3.org/2001/XMLSchema-instance"
               xsi:schemaLocation="http://www.focus_shift.de/jollyday/xml/ns/holiday http://www.focus_shift.de/jollyday/xml/ns/holiday/Holiday.xsd">
  <Holidays>
    <Fixed month="JANUARY" day="1" descriptionPropertiesKey="NEW_YEAR"/>
    <Fixed month="FEBRUARY" day="2" descriptionPropertiesKey="CANDELARIA"/>
    <Fixed month="MAY" day="1" descriptionPropertiesKey="LABOUR_DAY"/>
    <Fixed month="AUGUST" day="6" descriptionPropertiesKey="INDEPENDENCE_DAY"/>
    <Fixed month="NOVEMBER" day="1" descriptionPropertiesKey="ALL_SAINTS"/>
    <Fixed month="DECEMBER" day="25" descriptionPropertiesKey="CHRISTMAS"/>
    <ChristianHoliday type="EASTER" descriptionPropertiesKey="christian.EASTER"/>
    <ChristianHoliday type="GOOD_FRIDAY" descriptionPropertiesKey="christian.GOOD_FRIDAY"/>
    <ChristianHoliday type="CORPUS_CHRISTI" descriptionPropertiesKey="christian.CORPUS_CHRISTI"/>
  </Holidays>
</Configuration>
