<?xml version="1.0" encoding="UTF-8"?>

<Configuration hierarchy="uy" description="Uruguay"
               xmlns="http://www.focus_shift.de/jollyday/xml/ns/holiday"
               xmlns:xsi="http://www.w3.org/2001/XMLSchema-instance"
               xsi:schemaLocation="http://www.focus_shift.de/jollyday/xml/ns/holiday http://www.focus_shift.de/jollyday/xml/ns/holiday/Holiday.xsd">
  <Holidays>
    <Fixed month="JANUARY" day="1" descriptionPropertiesKey="NEW_YEAR"/>
    <Fixed month="JANUARY" day="6" descriptionPropertiesKey="EPIPHANY"/>
    <Fixed month="APRIL" day="19" descriptionPropertiesKey="LANDING_33_EASTERNERS">
      <MovingCondition substitute="TUESDAY" with="PREVIOUS" weekday="MONDAY"/>
      <MovingCondition substitute="WEDNESDAY" with="PREVIOUS" weekday="MONDAY"/>
      <MovingCondition substitute="THURSDAY" with="NEXT" weekday="MONDAY"/>
      <MovingCondition substitute="FRIDAY" with="NEXT" weekday="MONDAY"/>
    </Fixed>
    <Fixed month="MAY" day="1" descriptionPropertiesKey="LABOUR_DAY"/>
    <Fixed month="MAY" day="18" descriptionPropertiesKey="LAS_PIEDRAS">
      <MovingCondition substitute="TUESDAY" with="PREVIOUS" weekday="MONDAY"/>
      <MovingCondition substitute="WEDNESDAY" with="PREVIOUS" weekday="MONDAY"/>
      <MovingCondition substitute="THURSDAY" with="NEXT" weekday="MONDAY"/>
      <MovingCondition substitute="FRIDAY" with="NEXT" weekday="MONDAY"/>
    </Fixed>
    <Fixed month="JUNE" day="19" descriptionPropertiesKey="ARTIGAS"/>
    <Fixed month="JULY" day="18" descriptionPropertiesKey="CONSTITUTION_DAY"/>
    <Fixed month="AUGUST" day="25" descriptionPropertiesKey="INDEPENDENCE_DAY"/>
    <Fixed month="NOVEMBER" day="2" descriptionPropertiesKey="ALL_SOULS"/>
    <Fixed month="DECEMBER" day="25" descriptionPropertiesKey="CHRISTMAS"/>
    <Fixed month="OCTOBER" day="12" descriptionPropertiesKey="RACE">
      <MovingCondition substitute="TUESDAY" with="PREVIOUS" weekday="MONDAY"/>
      <MovingCondition substitute="WEDNESDAY" with="PREVIOUS" weekday="MONDAY"/>
      <MovingCondition substitute="THURSDAY" with="NEXT" weekday="MONDAY"/>
      <MovingCondition substitute="FRIDAY" with="NEXT" weekday="MONDAY"/>
    </Fixed>
    <ChristianHoliday type="EASTER" descriptionPropertiesKey="christian.EASTER"/>
    <ChristianHoliday type="SHROVE_MONDAY" descriptionPropertiesKey="christian.SHROVE_MONDAY"/>
    <ChristianHoliday type="CARNIVAL" descriptionPropertiesKey="christian.CARNIVAL"/>
    <ChristianHoliday type="MAUNDY_THURSDAY" descriptionPropertiesKey="christian.MAUNDY_THURSDAY"/>
    <ChristianHoliday type="GOOD_FRIDAY" descriptionPropertiesKey="christian.GOOD_FRIDAY"/>
  </Holidays>
</Configuration>
