<?xml version="1.0" encoding="UTF-8"?>
<Configuration hierarchy="is" description="Iceland"
               xmlns="https://focus_shift.de/jollyday/schema/holiday"
               xmlns:xsi="http://www.w3.org/2001/XMLSchema-instance"
               xsi:schemaLocation="https://focus_shift.de/jollyday/schema/holiday https://focus_shift.de/jollyday/schema/holiday/holiday.xsd">
  <Holidays>
    <Fixed month="APRIL" day="4"/>
    <Fixed month="MAY" day="1" descriptionPropertiesKey="LABOUR_DAY"/>
    <Fixed month="DECEMBER" day="26"/>
    <Fixed month="DECEMBER" day="24" descriptionPropertiesKey="CHRISTMAS_EVE"/>
    <Fixed month="JANUARY" day="1"/>
    <Fixed month="JANUARY" day="6"/>
    <Fixed month="MAY" day="13"/>
    <Fixed month="DECEMBER" day="25" descriptionPropertiesKey="CHRISTMAS"/>
    <Fixed month="APRIL" day="5"/>
    <Fixed month="DECEMBER" day="1"/>
    <Fixed month="JUNE" day="17"/>
    <Fixed month="JUNE" day="24"/>
    <Fixed month="DECEMBER" day="31"/>
    <Fixed month="FEBRUARY" day="18"/>
    <Fixed month="MARCH" day="1"/>
    <Fixed month="NOVEMBER" day="16"/>
  </Holidays>
</Configuration>
