<?xml version="1.0" encoding="UTF-8"?>

<Configuration hierarchy="hu" description="Hungary"
               xmlns="http://www.focus_shift.de/jollyday/xml/ns/holiday"
               xmlns:xsi="http://www.w3.org/2001/XMLSchema-instance"
               xsi:schemaLocation="http://www.focus_shift.de/jollyday/xml/ns/holiday http://www.focus_shift.de/jollyday/xml/ns/holiday/Holiday.xsd">
  <Holidays>
    <Fixed month="JANUARY" day="1" descriptionPropertiesKey="NEW_YEAR"/>
    <Fixed month="MARCH" day="15" descriptionPropertiesKey="NATIONAL_DAY"/>
    <Fixed month="MAY" day="1" descriptionPropertiesKey="LABOUR_DAY"/>
    <Fixed month="AUGUST" day="20" descriptionPropertiesKey="STEPHENS"/>
    <Fixed month="OCTOBER" day="23" descriptionPropertiesKey="NATIONAL_DAY"/>
    <Fixed month="NOVEMBER" day="1" descriptionPropertiesKey="ALL_SAINTS"/>
    <Fixed month="DECEMBER" day="24" descriptionPropertiesKey="CHRISTMAS_EVE"/>
    <Fixed month="DECEMBER" day="25" descriptionPropertiesKey="CHRISTMAS"/>
    <Fixed month="DECEMBER" day="26" descriptionPropertiesKey="STEPHENS"/>
    <ChristianHoliday type="EASTER" descriptionPropertiesKey="christian.EASTER"/>
    <ChristianHoliday type="GOOD_FRIDAY" descriptionPropertiesKey="christian.GOOD_FRIDAY" validFrom="2017"/>
    <ChristianHoliday type="EASTER_MONDAY" descriptionPropertiesKey="christian.EASTER_MONDAY"/>
    <ChristianHoliday type="WHIT_MONDAY" descriptionPropertiesKey="christian.WHIT_MONDAY"/>
  </Holidays>
</Configuration>
