<?xml version="1.0" encoding="UTF-8"?>
<Configuration hierarchy="gb" description="United Kingdom of Great Britain and Northern Ireland"
               xmlns="https://focus_shift.de/jollyday/schema/holiday"
               xmlns:xsi="http://www.w3.org/2001/XMLSchema-instance"
               xsi:schemaLocation="https://focus_shift.de/jollyday/schema/holiday https://focus_shift.de/jollyday/schema/holiday/holiday.xsd">
  <Holidays>
    <Fixed month="APRIL" day="2" descriptionPropertiesKey="christian.GOOD_FRIDAY"/>
    <Fixed month="MAY" day="3" descriptionPropertiesKey="EARLY_MAY_BANK_HOLIDAY"/>
    <Fixed month="MAY" day="31" descriptionPropertiesKey="SPRING_BANK_HOLIDAY"/>
    <Fixed month="DECEMBER" day="27" descriptionPropertiesKey="CHRISTMAS"/>
    <Fixed month="DECEMBER" day="28" descriptionPropertiesKey="BOXING_DAY"/>
  </Holidays>
  <SubConfigurations hierarchy="en" description="England">
    <Holidays>
      <Fixed month="JANUARY" day="1" descriptionPropertiesKey="NEW_YEAR"/>
      <Fixed month="APRIL" day="5" descriptionPropertiesKey="christian.EASTER_MONDAY"/>
      <Fixed month="AUGUST" day="30" descriptionPropertiesKey="SUMMER_BANK_HOLIDAY"/>
    </Holidays>
  </SubConfigurations>
  <SubConfigurations hierarchy="ni" description="Northern Ireland">
    <Holidays>
      <Fixed month="JANUARY" day="1" descriptionPropertiesKey="NEW_YEAR"/>
      <Fixed month="MARCH" day="17" descriptionPropertiesKey="ST_PATRICK"/>
      <Fixed month="JULY" day="12" descriptionPropertiesKey="BATTLE_BOYNE"/>
      <Fixed month="APRIL" day="5" descriptionPropertiesKey="christian.EASTER_MONDAY"/>
      <Fixed month="AUGUST" day="30" descriptionPropertiesKey="SUMMER_BANK_HOLIDAY"/>
    </Holidays>
  </SubConfigurations>
  <SubConfigurations hierarchy="sc" description="Scotland">
    <Holidays>
      <Fixed month="JANUARY" day="1" descriptionPropertiesKey="NEW_YEAR"/>
      <Fixed month="JANUARY" day="4" descriptionPropertiesKey="NEW_YEAR"/>
      <Fixed month="AUGUST" day="2" descriptionPropertiesKey="SUMMER_BANK_HOLIDAY"/>
      <Fixed month="NOVEMBER" day="30" descriptionPropertiesKey="ST_ANDREW"/>
    </Holidays>
  </SubConfigurations>
  <SubConfigurations hierarchy="wa" description="Wales">
    <Holidays>
      <Fixed month="JANUARY" day="1" descriptionPropertiesKey="NEW_YEAR"/>
      <Fixed month="APRIL" day="5" descriptionPropertiesKey="christian.EASTER_MONDAY"/>
      <Fixed month="AUGUST" day="30" descriptionPropertiesKey="SUMMER_BANK_HOLIDAY"/>
    </Holidays>
  </SubConfigurations>
</Configuration>
