<?xml version="1.0" encoding="UTF-8"?>

<Configuration hierarchy="gb" description="United Kingdom of Great Britain and Northern Ireland"
               xmlns="https://focus_shift.de/jollyday/schema/holiday"
               xmlns:xsi="http://www.w3.org/2001/XMLSchema-instance"
               xsi:schemaLocation="https://focus_shift.de/jollyday/schema/holiday https://focus_shift.de/jollyday/schema/holiday/holiday.xsd">
  <Holidays>
    <Fixed month="JANUARY" day="1" descriptionPropertiesKey="NEW_YEAR">
      <MovingCondition substitute="SATURDAY" with="NEXT" weekday="MONDAY"/>
      <MovingCondition substitute="SUNDAY" with="NEXT" weekday="MONDAY"/>
    </Fixed>

    <Fixed month="DECEMBER" day="26" descriptionPropertiesKey="BOXING_DAY">
      <MovingCondition substitute="SATURDAY" with="NEXT" weekday="MONDAY"/>
      <MovingCondition substitute="SUNDAY" with="NEXT" weekday="TUESDAY"/>
    </Fixed>
    <Fixed month="DECEMBER" day="25" descriptionPropertiesKey="CHRISTMAS">
      <MovingCondition substitute="SATURDAY" with="NEXT" weekday="MONDAY"/>
      <MovingCondition substitute="SUNDAY" with="NEXT" weekday="TUESDAY"/>
    </Fixed>

    <!-- The 2020 bank holiday was moved from the 4th to the 8th of May -->
    <Fixed month="MAY" day="8" validFrom="2020" validTo="2020" descriptionPropertiesKey="EARLY_MAY_BANK_HOLIDAY"/>
    <!-- The 2022 spring bank holiday was moved from the 4th of May to the second of June -->
    <Fixed month="JUNE" day="2" validFrom="2022" validTo="2022" descriptionPropertiesKey="SPRING_BANK_HOLIDAY"/>
    <Fixed month="JUNE" day="3" validFrom="2022" validTo="2022" descriptionPropertiesKey="QUEENS_PLATINUM_JUBILEE"/>
    <Fixed month="SEPTEMBER" day="19" validFrom="2022" validTo="2022" descriptionPropertiesKey="QUEENS_STATE_FUNERAL"/>
    <Fixed month="MAY" day="8" validFrom="2023" validTo="2023" descriptionPropertiesKey="KINGS_CORONATION"/>

    <FixedWeekday which="FIRST" weekday="MONDAY" month="MAY" validFrom="1900" validTo="2019" descriptionPropertiesKey="EARLY_MAY_BANK_HOLIDAY"/>
    <FixedWeekday which="SECOND" weekday="FRIDAY" month="MAY" validFrom="2020" validTo="2020" descriptionPropertiesKey="EARLY_MAY_BANK_HOLIDAY"/>
    <FixedWeekday which="FIRST" weekday="MONDAY" month="MAY" validFrom="2021" descriptionPropertiesKey="EARLY_MAY_BANK_HOLIDAY"/>

    <FixedWeekday which="LAST" weekday="MONDAY" month="MAY" validTo="2021" descriptionPropertiesKey="SPRING_BANK_HOLIDAY"/>
    <FixedWeekday which="LAST" weekday="MONDAY" month="MAY" validFrom="2023" descriptionPropertiesKey="SPRING_BANK_HOLIDAY"/>

    <ChristianHoliday type="GOOD_FRIDAY" descriptionPropertiesKey="christian.GOOD_FRIDAY"/>
  </Holidays>

  <SubConfigurations hierarchy="eng" description="England">
    <Holidays>
      <FixedWeekday which="LAST" weekday="MONDAY" month="AUGUST" descriptionPropertiesKey="SUMMER_BANK_HOLIDAY"/>
      <ChristianHoliday type="EASTER_MONDAY" descriptionPropertiesKey="christian.EASTER_MONDAY"/>
    </Holidays>
  </SubConfigurations>
  <!-- England and Wales are always the same -->
  <SubConfigurations hierarchy="wls" description="Wales">
    <Holidays>
      <FixedWeekday which="LAST" weekday="MONDAY" month="AUGUST" descriptionPropertiesKey="SUMMER_BANK_HOLIDAY"/>
      <ChristianHoliday type="EASTER_MONDAY" descriptionPropertiesKey="christian.EASTER_MONDAY"/>
    </Holidays>
  </SubConfigurations>

  <SubConfigurations hierarchy="sct" description="Scotland">
    <Holidays>
      <Fixed month="JANUARY" day="2" descriptionPropertiesKey="2ND_JANUARY">
        <MovingCondition substitute="SATURDAY" with="NEXT" weekday="MONDAY"/>
        <MovingCondition substitute="SUNDAY" with="NEXT" weekday="TUESDAY"/>
        <MovingCondition substitute="MONDAY" with="NEXT" weekday="TUESDAY"/>
      </Fixed>
      <Fixed month="NOVEMBER" day="30" descriptionPropertiesKey="ST_ANDREW"/>
      <FixedWeekday which="FIRST" weekday="MONDAY" month="AUGUST" descriptionPropertiesKey="SUMMER_BANK_HOLIDAY"/>
    </Holidays>
  </SubConfigurations>

  <SubConfigurations hierarchy="nir" description="Northern Ireland">
    <Holidays>
      <Fixed month="MARCH" day="17" descriptionPropertiesKey="ST_PATRICK">
        <MovingCondition substitute="SATURDAY" with="NEXT" weekday="MONDAY"/>
        <MovingCondition substitute="SUNDAY" with="NEXT" weekday="MONDAY"/>
      </Fixed>
      <Fixed month="JULY" day="12" descriptionPropertiesKey="BATTLE_BOYNE">
        <MovingCondition substitute="SATURDAY" with="NEXT" weekday="MONDAY"/>
        <MovingCondition substitute="SUNDAY" with="NEXT" weekday="MONDAY"/>
      </Fixed>
      <FixedWeekday which="LAST" weekday="MONDAY" month="AUGUST" descriptionPropertiesKey="SUMMER_BANK_HOLIDAY"/>
      <ChristianHoliday type="EASTER_MONDAY" descriptionPropertiesKey="christian.EASTER_MONDAY"/>
    </Holidays>
  </SubConfigurations>
</Configuration>
