<?xml version="1.0" encoding="UTF-8"?>
<Configuration hierarchy="bm" description="Bermuda"
               xmlns="http://www.focus_shift.de/jollyday/xml/ns/holiday"
               xmlns:xsi="http://www.w3.org/2001/XMLSchema-instance"
               xsi:schemaLocation="http://www.focus_shift.de/jollyday/xml/ns/holiday http://www.focus_shift.de/jollyday/xml/ns/holiday/Holiday.xsd">
  <Holidays>
    <Fixed month="JANUARY" day="1" descriptionPropertiesKey="NEW_YEAR"/>
    <Fixed month="APRIL" day="10" descriptionPropertiesKey="christian.GOOD_FRIDAY"/>
    <Fixed month="MAY" day="29" descriptionPropertiesKey="BERMUDA_DAY"/>
    <Fixed month="JUNE" day="15" descriptionPropertiesKey="NATIONAL_HEROES_DAY"/>
    <Fixed month="JULY" day="30" descriptionPropertiesKey="EMANCIPATION_DAY"/>
    <Fixed month="JULY" day="31" descriptionPropertiesKey="MARY_PRINCE_DAY"/>
    <Fixed month="SEPTEMBER" day="7" descriptionPropertiesKey="LABOUR_DAY"/>
    <Fixed month="NOVEMBER" day="11" descriptionPropertiesKey="REMEMBRANCE"/>
    <Fixed month="DECEMBER" day="25" descriptionPropertiesKey="CHRISTMAS"/>
    <Fixed month="DECEMBER" day="28" descriptionPropertiesKey="BOXING_DAY"/>
  </Holidays>
</Configuration>
