<?xml version="1.0" encoding="UTF-8"?>

<Configuration hierarchy="no" description="Norway"
               xmlns="https://focus_shift.de/jollyday/schema/holiday"
               xmlns:xsi="http://www.w3.org/2001/XMLSchema-instance"
               xsi:schemaLocation="https://focus_shift.de/jollyday/schema/holiday https://focus_shift.de/jollyday/schema/holiday/holiday.xsd">
  <Holidays>
    <Fixed month="JANUARY" day="1" descriptionPropertiesKey="NEW_YEAR"/>
    <Fixed month="MAY" day="1" descriptionPropertiesKey="LABOUR_DAY"/>
    <Fixed month="MAY" day="17" descriptionPropertiesKey="CONSTITUTION_DAY"/>
    <Fixed month="DECEMBER" day="25" descriptionPropertiesKey="CHRISTMAS"/>
    <Fixed month="DECEMBER" day="26" descriptionPropertiesKey="STEPHENS"/>
    <ChristianHoliday type="EASTER" descriptionPropertiesKey="christian.EASTER"/>
    <ChristianHoliday type="MAUNDY_THURSDAY" descriptionPropertiesKey="christian.MAUNDY_THURSDAY"/>
    <ChristianHoliday type="GOOD_FRIDAY" descriptionPropertiesKey="christian.GOOD_FRIDAY"/>
    <ChristianHoliday type="EASTER_MONDAY" descriptionPropertiesKey="christian.EASTER_MONDAY"/>
    <ChristianHoliday type="ASCENSION_DAY" descriptionPropertiesKey="christian.ASCENSION_DAY"/>
    <ChristianHoliday type="WHIT_MONDAY" descriptionPropertiesKey="christian.WHIT_MONDAY"/>
    <ChristianHoliday type="PENTECOST" descriptionPropertiesKey="christian.PENTECOST"/>
  </Holidays>
</Configuration>
